{
  "bundle_id": "resilience-review-timeout",
  "description": "final.md §14.2/§13.15: high-risk deploy needs approval, approval times out, system fails closed -- no receipt, incident recorded, session canceled.",
  "policy_version": "policy-2026-07-03.dev",
  "sessions": [
    {
      "session_id": "sess-deploy-001",
      "created_at": "2026-07-03T14:00:00Z",
      "created_by": "user:jaden",
      "agent_id": "agent:ops-2",
      "workspace_id": "ws:platform",
      "goal": "Deploy release r42 to production.",
      "constraints": [
        "production deploys require human approval",
        "fail closed on timeout"
      ],
      "policy_profile": "ops-default",
      "initial_capability_ids": [
        "grant-deploy-prod"
      ],
      "journal_root": "0000000000000000000000000000000000000000000000000000000000000000",
      "status": "canceled"
    }
  ],
  "grants": [
    {
      "grant_id": "grant-deploy-prod",
      "issuer": "user:jaden",
      "holder": "agent:ops-2",
      "session_id": "sess-deploy-001",
      "scope": {
        "selector": {
          "resource_kind": "cloud_resource",
          "resource_id": "prod/app"
        },
        "actions": [
          "deploy"
        ]
      },
      "constraints": {
        "max_risk": "critical",
        "max_data_class": "internal"
      },
      "approval": {
        "mode": "human",
        "threshold_risk": "high",
        "reviewer_ids": [
          "user:jaden"
        ]
      },
      "expires_at": "2026-07-03T16:00:00Z",
      "delegation": "none",
      "revocation_handle": "rev:grant-deploy-prod",
      "policy_version": "policy-2026-07-03.dev",
      "reason": "Deploy approved releases to production."
    }
  ],
  "manifests": [
    {
      "action_id": "act-deploy-r42",
      "session_id": "sess-deploy-001",
      "tool_id": "deployer",
      "action_kind": "deploy",
      "target": {
        "resource_kind": "cloud_resource",
        "resource_id": "prod/app"
      },
      "inputs_digest": "sha256:in-deploy-r42",
      "inputs_summary": "Roll out release r42 to production.",
      "expected_side_effects": [
        "deployment"
      ],
      "required_grants": [
        "grant-deploy-prod"
      ],
      "risk_class": "high",
      "data_classes": [
        "internal"
      ],
      "idempotency_key": "idem-deploy-r42",
      "human_explanation": "Deploy the approved release to production."
    }
  ],
  "decisions": [
    {
      "decision_id": "dec-deploy",
      "action_id": "act-deploy-r42",
      "manifest_hash": "85d96ace013671c6d037545f916b7a9a13ed0386df916c5d7685c7d83ed1cfc3",
      "policy_version": "policy-2026-07-03.dev",
      "result": "needs_approval",
      "explanation": "grant policy requires human approval for this risk class",
      "created_at": "2026-07-03T14:01:00Z"
    }
  ],
  "model_route_decisions": [],
  "receipts": [],
  "journal": [
    {
      "seq": 0,
      "created_at": "2026-07-03T14:00:00Z",
      "event": {
        "kind": "session_created",
        "session": {
          "session_id": "sess-deploy-001",
          "created_at": "2026-07-03T14:00:00Z",
          "created_by": "user:jaden",
          "agent_id": "agent:ops-2",
          "workspace_id": "ws:platform",
          "goal": "Deploy release r42 to production.",
          "constraints": [
            "production deploys require human approval",
            "fail closed on timeout"
          ],
          "policy_profile": "ops-default",
          "initial_capability_ids": [
            "grant-deploy-prod"
          ],
          "journal_root": "0000000000000000000000000000000000000000000000000000000000000000",
          "status": "canceled"
        }
      },
      "prev_hash": "0000000000000000000000000000000000000000000000000000000000000000",
      "hash": "55996f3ed627353c1dc5b52680955198aa8980b1f9412e39edc08bf9a21c2c49"
    },
    {
      "seq": 1,
      "created_at": "2026-07-03T14:00:00Z",
      "event": {
        "kind": "capability_granted",
        "grant": {
          "grant_id": "grant-deploy-prod",
          "issuer": "user:jaden",
          "holder": "agent:ops-2",
          "session_id": "sess-deploy-001",
          "scope": {
            "selector": {
              "resource_kind": "cloud_resource",
              "resource_id": "prod/app"
            },
            "actions": [
              "deploy"
            ]
          },
          "constraints": {
            "max_risk": "critical",
            "max_data_class": "internal"
          },
          "approval": {
            "mode": "human",
            "threshold_risk": "high",
            "reviewer_ids": [
              "user:jaden"
            ]
          },
          "expires_at": "2026-07-03T16:00:00Z",
          "delegation": "none",
          "revocation_handle": "rev:grant-deploy-prod",
          "policy_version": "policy-2026-07-03.dev",
          "reason": "Deploy approved releases to production."
        }
      },
      "prev_hash": "55996f3ed627353c1dc5b52680955198aa8980b1f9412e39edc08bf9a21c2c49",
      "hash": "2ca535e75213608814d8862051ec3a5cf194c6263c268e02456a9e9b7f9758b1"
    },
    {
      "seq": 2,
      "created_at": "2026-07-03T14:01:00Z",
      "event": {
        "kind": "action_proposed",
        "manifest": {
          "action_id": "act-deploy-r42",
          "session_id": "sess-deploy-001",
          "tool_id": "deployer",
          "action_kind": "deploy",
          "target": {
            "resource_kind": "cloud_resource",
            "resource_id": "prod/app"
          },
          "inputs_digest": "sha256:in-deploy-r42",
          "inputs_summary": "Roll out release r42 to production.",
          "expected_side_effects": [
            "deployment"
          ],
          "required_grants": [
            "grant-deploy-prod"
          ],
          "risk_class": "high",
          "data_classes": [
            "internal"
          ],
          "idempotency_key": "idem-deploy-r42",
          "human_explanation": "Deploy the approved release to production."
        }
      },
      "prev_hash": "2ca535e75213608814d8862051ec3a5cf194c6263c268e02456a9e9b7f9758b1",
      "hash": "7b5a62def2ff0fd4e30778338f95ffa9b35c23c732763313409e421d27ecc7bc"
    },
    {
      "seq": 3,
      "created_at": "2026-07-03T14:01:00Z",
      "event": {
        "kind": "policy_decided",
        "decision": {
          "decision_id": "dec-deploy",
          "action_id": "act-deploy-r42",
          "manifest_hash": "85d96ace013671c6d037545f916b7a9a13ed0386df916c5d7685c7d83ed1cfc3",
          "policy_version": "policy-2026-07-03.dev",
          "result": "needs_approval",
          "explanation": "grant policy requires human approval for this risk class",
          "created_at": "2026-07-03T14:01:00Z"
        }
      },
      "prev_hash": "7b5a62def2ff0fd4e30778338f95ffa9b35c23c732763313409e421d27ecc7bc",
      "hash": "c6f1414c9914cf47a6849dfcfe4a8a5fe8f7194871f786a7b8ec8c33eb7d7b40"
    },
    {
      "seq": 4,
      "created_at": "2026-07-03T14:02:00Z",
      "event": {
        "kind": "incident_annotated",
        "incident_id": "inc-review-timeout",
        "note": "Human approval for act-deploy-r42 timed out past the review deadline; action not executed; session failing closed (final.md §14.2, §13.15)."
      },
      "prev_hash": "c6f1414c9914cf47a6849dfcfe4a8a5fe8f7194871f786a7b8ec8c33eb7d7b40",
      "hash": "f3fb6453360e78ece10dbaa717240b102fa6fff1b6a32bd2b8b97bdc8011dd3e"
    }
  ]
}
